{
  "schema": "dusk.process-results/v1",
  "id": "01a112fe-d1bc-73b3-8e1a-437e9578376d",
  "time": "2026-10-06T09:16:08.512408245Z",
  "pid": "13792273858822192861",
  "campaign_id": "0192f3a4-5b6c-7d8e-9f01-23456789abcd",
  "attempt": 1,
  "device_id": "3f9c0e2a7b5d4c1e8a6f0b2d9e7c5a13",
  "installation_id": "a41e6c2f9b0d4e7a8c3f5b1d2e9a6c70",
  "namespace_id": "5d2e9a1c7b3f8e04",
  "action_kind": "ensure_version",
  "status": "already_satisfied",
  "delivered": false,
  "error": null,
  "started_at": "2026-10-06T09:15:40.001200400Z",
  "finished_at": "2026-10-06T09:15:58.774501933Z",
  "dawn_instance": "dawn-0",
  "output_digest": "5f3c1a9e7b2d4f6a8c0e1b3d5f7a9c2e4b6d8f0a1c3e5b7d9f2a4c6e8b0d1f3a",
  "output_count": 0,
  "output_truncated": false,
  "reported": {
    "version_key": "dusk.version",
    "version": "0.2.0",
    "config_hash": null,
    "services": null,
    "facts": null
  }
}
